{
  "$schema": "https://json-schema.org/draft/2020-12/schema",
  "$id": "retrospective.schema.json",
  "title": "Retrospective",
  "description": "The Day 2 retrospective, one document for all groups at the root of the live-deck-data branch. scripts/team-signals.mjs writes `signals` from git and GitHub and never touches the rest. The retrospective skill writes every other section, copying `signals` unchanged. Every claim carries at least one piece of evidence and a confidence. Claims describe groups, never a person, and never rank groups.",
  "type": "object",
  "additionalProperties": false,
  "required": [
    "schemaVersion",
    "status",
    "updatedAt",
    "sources",
    "routes",
    "isThisYou",
    "decisions",
    "signals",
    "driving",
    "mistakes",
    "shortlist"
  ],
  "properties": {
    "schemaVersion": { "const": 1 },
    "status": {
      "description": "signals: only the script has run. draft: the synthesis has run. reviewed: a coach has checked and corrected it.",
      "enum": ["signals", "draft", "reviewed"]
    },
    "updatedAt": { "$ref": "#/$defs/timestamp" },
    "sources": {
      "description": "Section 1, how this was made: what the synthesis read overnight.",
      "type": "array",
      "maxItems": 10,
      "items": {
        "type": "object",
        "additionalProperties": false,
        "required": ["kind", "note"],
        "properties": {
          "kind": {
            "enum": [
              "git",
              "pr-timeline",
              "working-out",
              "observations",
              "coach-log"
            ]
          },
          "note": { "type": "string", "maxLength": 140 }
        }
      }
    },
    "routes": {
      "description": "Section 2, three routes: per group, the stations it was at over the afternoon, as a swimlane.",
      "type": "array",
      "maxItems": 10,
      "items": {
        "type": "object",
        "additionalProperties": false,
        "required": ["group", "segments"],
        "properties": {
          "group": { "$ref": "#/$defs/group" },
          "segments": {
            "type": "array",
            "maxItems": 20,
            "items": {
              "type": "object",
              "additionalProperties": false,
              "required": ["station", "from", "to", "evidence", "confidence"],
              "properties": {
                "station": { "$ref": "#/$defs/station" },
                "from": { "$ref": "#/$defs/timestamp" },
                "to": { "$ref": "#/$defs/timestampOrNull" },
                "evidence": { "$ref": "#/$defs/evidence" },
                "confidence": { "$ref": "#/$defs/confidence" }
              }
            }
          }
        }
      }
    },
    "isThisYou": {
      "description": "Section 3: per group, the claim about itself the synthesis is least sure of. A coach notes the group's correction live.",
      "type": "array",
      "maxItems": 10,
      "items": {
        "type": "object",
        "additionalProperties": false,
        "required": ["group", "claim", "correction", "evidence", "confidence"],
        "properties": {
          "group": { "$ref": "#/$defs/group" },
          "claim": { "type": "string", "maxLength": 140 },
          "correction": { "type": ["string", "null"], "maxLength": 140 },
          "evidence": { "$ref": "#/$defs/evidence" },
          "confidence": { "$ref": "#/$defs/confidence" }
        }
      }
    },
    "decisions": {
      "description": "Section 4, the decision grid revisited: each group's final call on the epic's seven points, and the rework a call caused later.",
      "type": "array",
      "maxItems": 10,
      "items": {
        "type": "object",
        "additionalProperties": false,
        "required": ["group", "calls"],
        "properties": {
          "group": { "$ref": "#/$defs/group" },
          "calls": {
            "type": "object",
            "additionalProperties": false,
            "required": [
              "join",
              "deadline",
              "multipleRestaurants",
              "editRights",
              "splitBill",
              "minimumOrderAndFee",
              "kitchenPerPerson"
            ],
            "properties": {
              "join": { "$ref": "#/$defs/decision" },
              "deadline": { "$ref": "#/$defs/decision" },
              "multipleRestaurants": { "$ref": "#/$defs/decision" },
              "editRights": { "$ref": "#/$defs/decision" },
              "splitBill": { "$ref": "#/$defs/decision" },
              "minimumOrderAndFee": { "$ref": "#/$defs/decision" },
              "kitchenPerPerson": { "$ref": "#/$defs/decision" }
            }
          }
        }
      }
    },
    "signals": {
      "description": "Section 5, team signals, not volume. Written only by scripts/team-signals.mjs. Null until it has run.",
      "$ref": "#/$defs/signals"
    },
    "driving": {
      "description": "Section 6, how each group drove its agent. Tool differences are anecdotes, since n = 3. No contrast between groups.",
      "type": "array",
      "maxItems": 10,
      "items": {
        "type": "object",
        "additionalProperties": false,
        "required": [
          "group",
          "tool",
          "tests",
          "corrections",
          "skillsFired",
          "steering",
          "saidByTheGroup",
          "anecdotes"
        ],
        "properties": {
          "group": { "$ref": "#/$defs/group" },
          "tool": {
            "description": "The tool and model from the how-we-worked note's header.",
            "type": "string",
            "maxLength": 80
          },
          "tests": {
            "type": "object",
            "additionalProperties": false,
            "required": ["order", "evidence", "confidence"],
            "properties": {
              "order": { "enum": ["before", "after", "mixed", "unknown"] },
              "evidence": { "$ref": "#/$defs/evidence" },
              "confidence": { "$ref": "#/$defs/confidence" }
            }
          },
          "corrections": {
            "description": "Where the group corrected its agent.",
            "type": "array",
            "maxItems": 5,
            "items": { "$ref": "#/$defs/textClaim" }
          },
          "skillsFired": {
            "type": "array",
            "maxItems": 12,
            "items": {
              "type": "object",
              "additionalProperties": false,
              "required": ["skill", "evidence", "confidence"],
              "properties": {
                "skill": { "type": "string", "maxLength": 64 },
                "evidence": { "$ref": "#/$defs/evidence" },
                "confidence": { "$ref": "#/$defs/confidence" }
              }
            }
          },
          "steering": {
            "description": "How the group shared the one computer, described without naming anyone.",
            "oneOf": [{ "type": "null" }, { "$ref": "#/$defs/textClaim" }]
          },
          "saidByTheGroup": {
            "description": "Quotes from the note's \"Said by the group\", shown next to the group's own timeline.",
            "type": "array",
            "maxItems": 3,
            "items": { "$ref": "#/$defs/textClaim" }
          },
          "anecdotes": {
            "type": "array",
            "maxItems": 3,
            "items": { "$ref": "#/$defs/textClaim" }
          }
        }
      }
    },
    "mistakes": {
      "description": "Section 7, where the agent went wrong: each mistake placed on the station where it started, with its origin, and repeats marked.",
      "type": "array",
      "maxItems": 30,
      "items": {
        "type": "object",
        "additionalProperties": false,
        "required": [
          "group",
          "text",
          "station",
          "origin",
          "repeated",
          "evidence",
          "confidence"
        ],
        "properties": {
          "group": { "$ref": "#/$defs/group" },
          "text": { "type": "string", "maxLength": 140 },
          "station": { "$ref": "#/$defs/station" },
          "origin": {
            "description": "Missing context, a gap in the spec, a missing check, or something review missed.",
            "enum": ["context", "spec", "check", "review"]
          },
          "repeated": { "type": "boolean" },
          "evidence": { "$ref": "#/$defs/evidence" },
          "confidence": { "$ref": "#/$defs/confidence" }
        }
      }
    },
    "shortlist": {
      "description": "Section 8, the hand-off to the skill lab: what went wrong twice, across groups, tagged with the thread where a fix could live (a line in AGENTS.md, a skill or a check). No suggested actions.",
      "type": "array",
      "maxItems": 12,
      "items": {
        "type": "object",
        "additionalProperties": false,
        "required": ["item", "groups", "thread", "evidence", "confidence"],
        "properties": {
          "item": { "type": "string", "maxLength": 140 },
          "groups": {
            "type": "array",
            "maxItems": 10,
            "items": { "$ref": "#/$defs/group" }
          },
          "thread": { "enum": ["context", "skills", "checks"] },
          "evidence": { "$ref": "#/$defs/evidence" },
          "confidence": { "$ref": "#/$defs/confidence" }
        }
      }
    }
  },
  "$defs": {
    "timestamp": {
      "type": "string",
      "pattern": "^\\d{4}-\\d{2}-\\d{2}T\\d{2}:\\d{2}:\\d{2}"
    },
    "timestampOrNull": {
      "oneOf": [{ "type": "null" }, { "$ref": "#/$defs/timestamp" }]
    },
    "sha": { "type": "string", "pattern": "^[0-9a-f]{7,40}$" },
    "group": { "type": "string", "pattern": "^[a-z0-9]+(-[a-z0-9]+)*$" },
    "hhmm": { "type": "string", "pattern": "^\\d{2}:\\d{2}$" },
    "station": {
      "enum": ["Explore", "Specify", "Slice", "Build", "Review", "Ship"]
    },
    "confidence": { "enum": ["high", "medium", "low"] },
    "evidence": {
      "description": "At least one item per claim: a file and a quote from it, a commit, a CI run, or a coach observation from the coaches' local log.",
      "type": "array",
      "maxItems": 5,
      "items": {
        "oneOf": [
          {
            "type": "object",
            "additionalProperties": false,
            "required": ["kind", "file", "quote"],
            "properties": {
              "kind": { "const": "file" },
              "file": { "type": "string", "maxLength": 200 },
              "quote": { "type": "string", "maxLength": 140 }
            }
          },
          {
            "type": "object",
            "additionalProperties": false,
            "required": ["kind", "sha"],
            "properties": {
              "kind": { "const": "commit" },
              "sha": { "$ref": "#/$defs/sha" }
            }
          },
          {
            "type": "object",
            "additionalProperties": false,
            "required": ["kind", "sha", "check", "result", "at"],
            "properties": {
              "kind": { "const": "ci" },
              "sha": { "$ref": "#/$defs/sha" },
              "check": { "type": "string", "maxLength": 64 },
              "result": { "enum": ["pass", "fail"] },
              "at": { "$ref": "#/$defs/timestamp" }
            }
          },
          {
            "type": "object",
            "additionalProperties": false,
            "required": ["kind"],
            "properties": { "kind": { "const": "coach-observation" } }
          }
        ]
      }
    },
    "textClaim": {
      "type": "object",
      "additionalProperties": false,
      "required": ["text", "evidence", "confidence"],
      "properties": {
        "text": { "type": "string", "maxLength": 140 },
        "evidence": { "$ref": "#/$defs/evidence" },
        "confidence": { "$ref": "#/$defs/confidence" }
      }
    },
    "decision": {
      "type": "object",
      "additionalProperties": false,
      "required": ["call", "line", "rework", "evidence", "confidence"],
      "properties": {
        "call": { "enum": ["in", "out", "open"] },
        "line": { "type": "string", "maxLength": 80 },
        "rework": {
          "description": "The rework this call caused after the checkpoint (spec changes, slices replanned), or null.",
          "type": ["string", "null"],
          "maxLength": 140
        },
        "evidence": { "$ref": "#/$defs/evidence" },
        "confidence": { "$ref": "#/$defs/confidence" }
      }
    },
    "ticket": {
      "type": "object",
      "additionalProperties": false,
      "required": ["ticket", "title"],
      "properties": {
        "ticket": {
          "description": "The ticket's file name in the working-out's issues folder.",
          "type": "string",
          "maxLength": 120
        },
        "title": { "type": "string", "maxLength": 80 }
      }
    },
    "signals": {
      "description": "Computed from git and the GitHub API, never by the model. The deck counts the lists; the numbers here are the script's. Null until the script has run.",
      "type": ["object", "null"],
      "additionalProperties": false,
      "required": [
        "computedAt",
        "timeZone",
        "kickoff",
        "lunch",
        "ciCheck",
        "groups"
      ],
      "properties": {
        "computedAt": { "$ref": "#/$defs/timestamp" },
        "timeZone": { "type": "string", "maxLength": 64 },
        "kickoff": { "$ref": "#/$defs/hhmm" },
        "lunch": {
          "type": "object",
          "additionalProperties": false,
          "required": ["from", "to"],
          "properties": {
            "from": { "$ref": "#/$defs/hhmm" },
            "to": { "$ref": "#/$defs/hhmm" }
          }
        },
        "ciCheck": {
          "description": "The check run that counts as CI.",
          "type": "string",
          "maxLength": 64
        },
        "groups": {
          "type": "array",
          "maxItems": 10,
          "items": { "$ref": "#/$defs/groupSignals" }
        }
      }
    },
    "groupSignals": {
      "type": "object",
      "additionalProperties": false,
      "required": [
        "group",
        "pr",
        "from",
        "head",
        "timeToSpec",
        "specRework",
        "firstPassCi",
        "reviewRounds",
        "drift"
      ],
      "properties": {
        "group": { "$ref": "#/$defs/group" },
        "pr": {
          "description": "The group's PR, or null when the script ran without one.",
          "type": ["integer", "null"],
          "minimum": 1
        },
        "from": {
          "description": "The commit the group's branch started from.",
          "$ref": "#/$defs/sha"
        },
        "head": { "$ref": "#/$defs/sha" },
        "timeToSpec": {
          "description": "Working minutes from the kickoff to the spec-reviewed label, lunch excluded, in the workshop's time zone. Null without a label.",
          "type": "object",
          "additionalProperties": false,
          "required": ["labelledAt", "minutes"],
          "properties": {
            "labelledAt": { "$ref": "#/$defs/timestampOrNull" },
            "minutes": { "type": ["integer", "null"], "minimum": 0 }
          }
        },
        "specRework": {
          "description": "The commits that changed the spec after the label. Empty without a label.",
          "type": "object",
          "additionalProperties": false,
          "required": ["changes"],
          "properties": {
            "changes": {
              "type": "array",
              "maxItems": 100,
              "items": {
                "type": "object",
                "additionalProperties": false,
                "required": ["sha", "at"],
                "properties": {
                  "sha": { "$ref": "#/$defs/sha" },
                  "at": { "$ref": "#/$defs/timestamp" }
                }
              }
            }
          }
        },
        "firstPassCi": {
          "description": "Per slice, in ticket order: its CI runs up to and including the first green. A run belongs to the slice in progress at its commit, read from the tickets' Status lines, and counts once that slice has changed code. One entry with a null ticket when the tickets' Status lines never moved.",
          "type": "object",
          "additionalProperties": false,
          "required": ["slices"],
          "properties": {
            "slices": {
              "type": "array",
              "maxItems": 30,
              "items": {
                "type": "object",
                "additionalProperties": false,
                "required": ["ticket", "title", "runs"],
                "properties": {
                  "ticket": { "type": ["string", "null"], "maxLength": 120 },
                  "title": { "type": ["string", "null"], "maxLength": 80 },
                  "runs": {
                    "type": "array",
                    "maxItems": 100,
                    "items": {
                      "type": "object",
                      "additionalProperties": false,
                      "required": ["sha", "at", "result"],
                      "properties": {
                        "sha": { "$ref": "#/$defs/sha" },
                        "at": { "$ref": "#/$defs/timestamp" },
                        "result": { "enum": ["pass", "fail"] }
                      }
                    }
                  }
                }
              }
            }
          }
        },
        "reviewRounds": {
          "description": "Rounds in the group's review.md, counted as the reporter counts them.",
          "type": "object",
          "additionalProperties": false,
          "required": ["rounds", "file"],
          "properties": {
            "rounds": { "type": "integer", "minimum": 0 },
            "file": { "type": ["string", "null"], "maxLength": 200 }
          }
        },
        "drift": {
          "description": "Slices planned (the first tickets written) against shipped (Status done at the head), and the changed files the final spec and tickets never name.",
          "type": "object",
          "additionalProperties": false,
          "required": ["planned", "shipped", "added", "dropped", "outsidePlan"],
          "properties": {
            "planned": {
              "type": "array",
              "maxItems": 30,
              "items": { "$ref": "#/$defs/ticket" }
            },
            "shipped": {
              "type": "array",
              "maxItems": 30,
              "items": { "$ref": "#/$defs/ticket" }
            },
            "added": {
              "type": "array",
              "maxItems": 30,
              "items": { "$ref": "#/$defs/ticket" }
            },
            "dropped": {
              "type": "array",
              "maxItems": 30,
              "items": { "$ref": "#/$defs/ticket" }
            },
            "outsidePlan": {
              "type": "array",
              "maxItems": 200,
              "items": { "type": "string", "maxLength": 200 }
            }
          }
        }
      }
    }
  }
}
